Reference	ID	Tags	Quote	Occurrence	Question	Response	Question
front:intro	pla1			0	# Questions d'étude sur l'Évangile de Marc. Posez-vous les questions suivantes en lisant attentivement ce livre, et priez Dieu qu'il vous ouvre les yeux afin que vous perceviez clairement son message.		# Philippians Study Questions\n\nAsk yourself these questions as you carefully read this letter, and pray to God that he will open your eyes to see his message clearly.
1:1	uk55	basic,interpret	Παῦλος καὶ Τιμόθεος	1	Pourquoi **Paul** mentionne-t-il **Timothée** comme co-auteur de cette lettre ?		Why might **Paul** be including **Timothy** as a co-author of this letter?
1:1	f1b5	basic,observe	δοῦλοι Χριστοῦ Ἰησοῦ	1	Quel titre Paul utilise-t-il pour se présenter et présenter Timothée ?		What title does Paul use to describe himself and Timothy?
1:1	qhd9	basic,observe	πᾶσιν τοῖς ἁγίοις ἐν Χριστῷ Ἰησοῦ τοῖς οὖσιν ἐν Φιλίπποις	1	Quel terme Paul utilise-t-il pour décrire les croyants **qui sont à Philippes** ?		What term did Paul use to describe the believers **at Philippi**?
1:1	hyp6	basic,interpret	σὺν ἐπισκόποις καὶ διακόνοις	1	Selon vous, pourquoi Paul s'adresse-t-il particulièrement aux **responsables et** aux **gestionnaires** dans cette lettre ?		Why do you think Paul especially mentioned **the overseers and deacons** in this letter?
1:2	hud2	basic,observe	χάρις ὑμῖν καὶ εἰρήνη	1	Quelles sont les deux choses que Paul souhaitait pour les croyants de Philippes ?		What two things did Paul desire for the believers at Philippi?
1:2	z9dq	basic,observe	χάρις ὑμῖν καὶ εἰρήνη ἀπὸ Θεοῦ Πατρὸς ἡμῶν καὶ Κυρίου Ἰησοῦ Χριστοῦ	1	De qui proviennent la **grâce** et la **paix** ?		Who is the source of **Grace** and **peace**?
1:3	l000	basic,observe	εὐχαριστῶ τῷ Θεῷ μου ἐπὶ πάσῃ τῇ μνείᾳ ὑμῶν	1	Pourquoi Paul **remercie**-t-il son **Dieu** ?		What caused Paul to **thank** his **God**?
1:4-5	fud1	basic,observe	μετὰ χαρᾶς τὴν δέησιν ποιούμενος, & ἐπὶ τῇ κοινωνίᾳ ὑμῶν εἰς τὸ εὐαγγέλιον, ἀπὸ τῆς πρώτης ἡμέρας ἄχρι τοῦ νῦν	1	Pourquoi Paul priait-il **avec joie** ?		What was the reason that Paul prayed **with joy**?
1:5	l001	basic,interpret	τῇ κοινωνίᾳ ὑμῶν εἰς τὸ εὐαγγέλιον, ἀπὸ τῆς πρώτης ἡμέρας ἄχρι τοῦ νῦν	1	De quelle manière les Philippiens ont-ils participé **au projet commun qui fait avancer l'Évangile** avec Paul, **depuis le début, jusqu'à aujourd'hui** ?		In what way might the Philippians have had a **partnership** with Paul **in the gospel from the first day until now**?
1:6	nr63	basic,observe	ὅτι ὁ ἐναρξάμενος ἐν ὑμῖν ἔργον ἀγαθὸν, ἐπιτελέσει ἄχρι ἡμέρας Χριστοῦ Ἰησοῦ	1	Quelle est la réalité dont Paul est devenu confiant au sujet des Philippiens ?		What was the truth about which Paul had become confident concerning the Philippians?
1:6	vhj8	basic,interpret	ὁ ἐναρξάμενος ἐν ὑμῖν ἔργον ἀγαθὸν	1	Quel était le **bon travail** que Dieu avait commencé dans les croyants philippins ?		What was the **good work** which God had begun in the Philippian believers?
1:6	h7q1	basic,interpret	ἐπιτελέσει ἄχρι ἡμέρας Χριστοῦ Ἰησοῦ	1	Que signifie-t-il pour Dieu de **poursuivre** ce travail **jusqu'au bout** parmi les Philippiens ?		What does it mean for God to **carry** this work **on to completion** in the Philippians?
1:7	l002	basic,observe	ἔν τε τοῖς δεσμοῖς μου, καὶ ἐν τῇ ἀπολογίᾳ καὶ βεβαιώσει τοῦ εὐαγγελίου, συνκοινωνούς μου τῆς χάριτος πάντας ὑμᾶς ὄντας	1	Qu'ont fait les Philippiens pour que Paul ait des sentiments élogieux à leur égard et les ait dans son cœur ?		What had the Philippians done in order to cause Paul to think positively about them and to have them in his heart?
1:7	l003	basic,interpret	ἔν τε τοῖς δεσμοῖς μου, καὶ ἐν τῇ ἀπολογίᾳ καὶ βεβαιώσει τοῦ εὐαγγελίου, συνκοινωνούς μου τῆς χάριτος	1	De quelle manière pensez-vous que les croyants de Philippes ont été **participants avec** Paul **de la grâce** lors de son arrestation et de ses épreuves ?		In what way do you think the Philippian believers were **partners in grace** with Paul during his arrest and trials?
1:8	gb16	basic,interpret	μάρτυς γάρ μου ὁ Θεός	1	Quel effet cela a-t-il pu avoir sur les Philippiens lorsque Paul a fait appel à Dieu pour qu'il soit **témoin** de son amour pour eux ?		What affect might it have had on the Philippians when Paul called upon God to be his **witness** to his love for them?
1:8	l004	basic,apply	ὡς ἐπιποθῶ πάντας ὑμᾶς ἐν σπλάγχνοις Χριστοῦ Ἰησοῦ	1	Que veut dire Paul lorsqu'il affirme qu'il aime les Philippiens **avec l'affection profonde du Christ Jésus-Christ** ?		What does Paul mean when he says that he longs for the Philippians **with the affection of Christ Jesus**?
1:9	a4q9	basic,observe	καὶ τοῦτο προσεύχομαι, ἵνα ἡ ἀγάπη ὑμῶν ἔτι μᾶλλον καὶ μᾶλλον περισσεύῃ	1	Quel domaine de la vie des Philippiens Paul souhaitait-il voir grandir **de plus en plus** ?		What did Paul want to **abound more and more**?
1:9	l228	basic,interpret	ἵνα ἡ ἀγάπη ὑμῶν ἔτι μᾶλλον καὶ μᾶλλον περισσεύῃ ἐν ἐπιγνώσει καὶ πάσῃ αἰσθήσει	1	Pourquoi était-il important pour Paul que l'**amour** des croyants de Philippes s'accompagne **de connaissance, et de discernement en tout** ?		Why was important to Paul that the **love** of the Philippian believers would increase **in knowledge and depth of insight**?
1:9-10	gzw1	basic,interpret	ἐν ἐπιγνώσει καὶ πάσῃ αἰσθήσει, & εἰς τὸ δοκιμάζειν ὑμᾶς τὰ διαφέροντα	1	Comment la **connaissance** et le **discernement en tout** permettraient-ils aux Philippiens de distinguer **les meilleures choses** ?		How would **knowledge and depth of insight** enable the Philippians to **prove what is best**?
01:10	d3ua	basic,observe	ἵνα ἦτε εἰλικρινεῖς καὶ ἀπρόσκοποι εἰς ἡμέραν Χριστοῦ	1	Ici, **pour que** introduit le but pour lequel Paul veut que les Philippiens soient capables de distinguer les meilleures choses. Quel est ce but ?		Here **so that** introduces the purpose for which Paul wants the Philippians to be able to approve what excels. What is that purpose?
01:10	nnu9	basic,interpret	εἰς ἡμέραν Χριστοῦ	1	Que désigne le **jour du Christ** dont parle Paul ?		What is **the day of Christ** to which Paul refers?
01:11	uu87	basic,observe	πεπληρωμένοι καρπὸν δικαιοσύνης	1	De quoi les Philippiens seront-ils remplis s'ils sont **purs** et **inattaquables** ?		What will fill the Philippians if they are pure and blameless?
01:11	l009	basic,interpret	καρπὸν δικαιοσύνης	1	À quelle catégorie de choses le **fruit de la justice** renvoie-t-il ?		To what kind of things does **the fruit of righteousness** refer?
01:11	csc9	basic,observe	καρπὸν δικαιοσύνης τὸν διὰ Ἰησοῦ Χριστοῦ	1	D'où vient le **fruit de la justice** ?		What is the source of **the fruit of righteousness**?
01:11	c7cj	basic,observe	εἰς δόξαν καὶ ἔπαινον Θεοῦ	1	Dans quel but Jésus nous donne-t-il le fruit de la justice ?		For what purpose does Jesus give us the fruit of righteousness?
01:12	l010	basic,observe	τὰ κατ’ ἐμὲ, μᾶλλον εἰς προκοπὴν τοῦ εὐαγγελίου ἐλήλυθεν	1	Selon Paul, pourquoi Dieu a-t-il permis qu'il soit arrêté et jugé ?		What did Paul believe was the reason God allowed him to be arrested and tried?
01:13	l011	basic,observe	ὥστε τοὺς δεσμούς μου φανεροὺς ἐν Χριστῷ γενέσθαι, ἐν ὅλῳ τῷ πραιτωρίῳ καὶ τοῖς λοιποῖς πᾶσιν	1	Quelles personnes ont appris que Paul était enchaîné parce qu'il est **en Christ** ?		**As a result** of Paul's trials, who learned that he was **in chains for Christ**?
01:13	jr7f	basic,interpret	ὅλῳ τῷ πραιτωρίῳ	1	En quoi le fait que **tous les soldats** connaissaient la situation de Paul aurait-il pu contribuer à l'avancement de l'Évangile ?		How might **the whole palace guard** knowing about Paul's situation have resulted in the advancement of the gospel?
01:14	l012	basic,interpret	καὶ τοὺς πλείονας τῶν ἀδελφῶν ἐν Κυρίῳ πεποιθότας τοῖς δεσμοῖς μου, περισσοτέρως τολμᾶν ἀφόβως τὸν λόγον λαλεῖν	1	Selon vous, pourquoi la connaissance des **chaînes** de Paul a-t-elle incité la **plupart des frères** à être **plus confiants** dans l'annonce de **la parole** ?		Why do you think the knowledge of Paul's **chains** caused **most of the brothers** to dare more fearlessly to speak the word**?
01:15	vyl8	basic,observe	τινὲς μὲν καὶ διὰ φθόνον καὶ ἔριν, τινὲς δὲ καὶ δι’ εὐδοκίαν τὸν Χριστὸν κηρύσσουσιν	1	Pourquoi différents frères ont-ils proclamé le Christ à la suite des chaînes de Paul ?		What were the reasons that different brothers proclaimed Christ as a result of Paul's chains?
01:16	abc1	basic,observe	οἱ μὲν ἐξ ἀγάπης εἰδότες ὅτι εἰς ἀπολογίαν τοῦ εὐαγγελίου κεῖμαι	1	Quelles sont les bonnes raisons qui ont poussé certains frères à proclamer le Christ ?		What good motives caused some of the brothers to proclaim Christ?
01:17	wed9	basic,observe	οἱ δὲ ἐξ ἐριθείας τὸν Χριστὸν καταγγέλλουσιν, οὐχ ἁγνῶς οἰόμενοι θλῖψιν ἐγείρειν τοῖς δεσμοῖς μου	1	Quelles sont les mauvaises raisons qui ont poussé d'autres frères à proclamer le Christ ?		What bad motives caused some of the brothers to proclaim Christ?
01:18	vq5g	basic,observe	τί γάρ? πλὴν ὅτι παντὶ τρόπῳ, εἴτε προφάσει εἴτε ἀληθείᾳ, Χριστὸς καταγγέλλεται; καὶ ἐν τούτῳ χαίρω, ἀλλὰ καὶ χαρήσομαι	1	Comment Paul a-t-il réagi face aux frères qui proclamaient le Christ pour de bonnes et de mauvaises motivations ?		How did Paul respond to brothers proclaiming Christ from both good and bad motives?
01:18	pa9c	basic,apply	πλὴν ὅτι παντὶ τρόπῳ, εἴτε προφάσει εἴτε ἀληθείᾳ, Χριστὸς καταγγέλλεται; καὶ ἐν τούτῳ χαίρω	1	Êtes-vous, comme Paul, capable de vous réjouir lorsque vous voyez des frères prêcher le Christ pour de mauvaises motivations, ou pour vous causer des ennuis ?		Are you, like Paul, able to **rejoice** when you see brothers preach Christ for bad motives, or to cause you trouble?
01:19	l013	basic,observe	οἶδα γὰρ ὅτι τοῦτό μοι ἀποβήσεται εἰς σωτηρίαν διὰ τῆς ὑμῶν δεήσεως, καὶ ἐπιχορηγίας τοῦ Πνεύματος Ἰησοῦ Χριστοῦ	1	Comment Paul sera-t-il libéré de ses soucis actuels ?		What will cause Paul to be delivered from his current troubles?
01:20	ph9z	basic,observe	κατὰ τὴν ἀποκαραδοκίαν καὶ ἐλπίδα μου, ὅτι ἐν οὐδενὶ αἰσχυνθήσομαι	1	Qu'est-ce que Paul attend avec une **assurance ferme** et **espoir** ?		What did Paul **eagerly expect and hope**?
01:20	bjl6	basic,interpret	ἀλλ’ ἐν πάσῃ παρρησίᾳ	1	Pourquoi était-il si important que Paul soit **sûr à 100%** dans sa situation actuelle ?		Why was it so important that Paul **have complete boldness** in his present situation?
01:20	ntl8	basic,observe	ὡς πάντοτε καὶ νῦν, μεγαλυνθήσεται Χριστὸς ἐν τῷ σώματί μου, εἴτε διὰ ζωῆς εἴτε διὰ θανάτου	1	Quelle était la chose la plus importante que Paul désirait accomplir ?		What was the most important thing Paul wanted to accomplish?
01:20	uwu7	basic,interpret	εἴτε διὰ ζωῆς εἴτε διὰ θανάτου	1	Pensez-vous qu'il était facile pour Paul de dire qu'il était prêt à servir le Christ par sa **vie** ou par sa **mort** ? Pourquoi ou pourquoi pas ?		Do you think it was easy for Paul to say he was willing to serve Christ **by life or by death**? Why or why not?
01:20	b8b7	basic,observe	ὡς πάντοτε καὶ νῦν, μεγαλυνθήσεται Χριστὸς ἐν τῷ σώματί μου, εἴτε διὰ ζωῆς εἴτε διὰ θανάτου	1	Si, comme Paul à l'époque, vous étiez jugé à cause de votre foi, pensez-vous que vous auriez la même attitude que Paul ?		If you, like Paul at that time, were on trial for your faith, do you think you would have the same attitude as Paul had?
01:21	c8ss	basic,interpret	ἐμοὶ γὰρ τὸ ζῆν Χριστὸς, καὶ τὸ ἀποθανεῖν κέρδος	1	Selon vous, comment Paul a-t-il pu arriver à de telles convictions, à savoir que la vie ou la mort sont acceptables pour être avec le Christ ?		How do you think Paul was able to arrive at the conviction that either life or death is acceptable in order to be with Christ?
01:22	r3aa	basic,interpret	εἰ δὲ τὸ ζῆν ἐν σαρκί, τοῦτό μοι καρπὸς ἔργου	1	S'il continuait à vivre, quel **fruit** Paul pourrait-il **porter** ?		What is the **fruitful labor** that Paul would be able to do if he continued to live?
1:22-23	d1zm	basic,interpret	καὶ τί αἱρήσομαι, οὐ γνωρίζω & συνέχομαι δὲ ἐκ τῶν δύο	1	Paul fait valoir son point de vue en disant que la vie ou la mort sont acceptables pour lui. Cependant, pensez-vous que Paul croyait qu'il pouvait décider s'il allait vivre ou mourir ?		Paul is making a point by saying life or death are acceptable for him. However, do you think Paul really believed that he would be the one to decide if he lived or died?
01:23	l014	basic,interpret	τὴν ἐπιθυμίαν ἔχων εἰς τὸ ἀναλῦσαι καὶ σὺν Χριστῷ εἶναι, πολλῷ γὰρ μᾶλλον κρεῖσσον	1	Pourquoi Paul pensait-il qu'il serait **bien mieux** pour lui de mourir que de vivre ?		Why did Paul believe it would be **far better indeed** for himself to die than to live?
01:24	sfb1	basic,interpret	τὸ δὲ ἐπιμένειν ἐν τῇ σαρκὶ, ἀναγκαιότερον δι’ ὑμᾶς	1	Pourquoi Paul pensait-il qu'il était **plus nécessaire** pour les croyants de Philippes qu'il vive plutôt qu'il ne meure ?		Why did Paul believe it would be **more necessary** for the Philippian believers if he were to live rather than die?
1:23-24	ki8l	basic,interpret	πολλῷ & μᾶλλον κρεῖσσον & ἀναγκαιότερον	1	Selon vous, pourquoi Paul a-t-il **la meilleure chose** à ce qui était **plus nécessaire** ?		Why do you think Paul contrasted what was **far better indeed** against what was **more necessary**?
1:24-25	es4l	basic,observe	τὸ & ἐπιμένειν ἐν τῇ σαρκὶ, ἀναγκαιότερον δι’ ὑμᾶς & καὶ τοῦτο πεποιθὼς, οἶδα ὅτι μενῶ καὶ παραμενῶ πᾶσιν ὑμῖν	1	Qu'est-ce qui pousse Paul à croire qu'il continuera à vivre ?		What fact causes Paul to believe that he will continue to live?
01:25	l015	basic,observe	μενῶ καὶ παραμενῶ πᾶσιν ὑμῖν εἰς τὴν ὑμῶν προκοπὴν καὶ χαρὰν τῆς πίστεως	1	À quoi Paul s'attendait-il concernant les Philippiens s'il restait en vie ?		What did Paul expect to happen to the Philippians as a result of his remaining alive?
01:26	l016	basic,interpret	ἵνα τὸ καύχημα ὑμῶν περισσεύῃ ἐν Χριστῷ Ἰησοῦ ἐν ἐμοὶ, διὰ τῆς ἐμῆς παρουσίας πάλιν πρὸς ὑμᾶς	1	Pourquoi le fait que Paul soit libéré et revienne à Philippes aurait-il conduit les Philippiens à **rendre encore plus gloire au Christ Jésus** ? Comment auraient-ils participé à sa libération ?		Why would Paul being released and coming to Philippi again cause the **exultation in Christ Jesus** of the Philippians to **resound**? How would they have participated in his release?
01:27	l017	basic,observe	μόνον ἀξίως τοῦ εὐαγγελίου τοῦ Χριστοῦ πολιτεύεσθε & στήκετε ἐν ἑνὶ πνεύματι, μιᾷ ψυχῇ συναθλοῦντες τῇ πίστει τοῦ εὐαγγελίου	1	Comment Paul s'attendait-il à ce que les croyants de Philippes réagissent à son emprisonnement et à sa libération attendue ?		How did Paul expect that Philippian believers to react to his imprisonment and his expected release?
01:27	n654	basic,observe	ἵνα εἴτε ἐλθὼν καὶ ἰδὼν ὑμᾶς, εἴτε ἀπὼν, ἀκούω τὰ περὶ ὑμῶν	1	Dans quelle mesure Paul était-il sûr de revenir auprès des Philippiens lorsqu'il sera finalement libéré ?		How sure was Paul that he would be able to come to the Philippians when he was eventually released?
01:28	q1p8	basic,interpret	καὶ μὴ πτυρόμενοι ἐν μηδενὶ ὑπὸ τῶν ἀντικειμένων	1	De quelle manière pensez-vous que certaines personnes se sont opposées aux Philippiens et les ont **effrayés** ?		In what way do you think some people opposed the Philippians and caused them to be **frightened**?
01:28	td57	basic,observe	ἥτις ἐστὶν αὐτοῖς ἔνδειξις ἀπωλείας, ὑμῶν δὲ σωτηρίας	1	En quoi l'assurance des Philippiens au milieu de l'opposition serait-elle un **signe de ruine** pour leurs ennemis, mais aussi **de salut** pour les croyants de Philippes ?		Why would the confidence of the Philippians in the midst of opposition be **a clear sign** of the **destruction** of their enemies and of the **salvation** of the Philippian believers?
1:28-29	sz79	basic,interpret	καὶ τοῦτο ἀπὸ Θεοῦ; & ὅτι ὑμῖν ἐχαρίσθη τὸ ὑπὲρ Χριστοῦ, οὐ μόνον τὸ εἰς αὐτὸν πιστεύειν, ἀλλὰ καὶ τὸ ὑπὲρ αὐτοῦ πάσχειν	1	Selon vous, pourquoi le plan de Dieu est-il de donner aux Philippiens **la capacité non seulement de croire en lui, mais aussi de souffrir pour lui** ?		Why do you think it is God‘s plan to give the Philippians the ability both **to believe in Him** and **to suffer for Him**?
01:30	abc2	basic,interpret	τὸν αὐτὸν ἀγῶνα ἔχοντες, οἷον εἴδετε ἐν ἐμοὶ, καὶ νῦν ἀκούετε ἐν ἐμοί	1	Comment la relation entre les Philippiens et Paul les a-t-elle préparés à persévérer dans la souffrance au nom de Dieu ?		How had the Philippians relationship with Paul prepared them to be able to persevere through suffering for God?
01:30	hgb9	basic,apply	τὸν αὐτὸν ἀγῶνα ἔχοντες, οἷον εἴδετε ἐν ἐμοὶ, καὶ νῦν ἀκούετε ἐν ἐμοί	1	Quelles sont les luttes que vous menez dans votre propre vie et pour lesquelles le témoignage de l'apôtre Paul peut vous encourager ?		What struggles do you have in your own life in which you can be encouraged by the testimony of the Apostle Paul?
2:1	l019	basic,interpret	εἴ τις & εἴ τι & εἴ τις & εἴ τις	1	Quelle est la seule réponse possible à chaque question posée par Paul  ?		When Paul says **if any**, do you think he is implying that these things do or do not exist?
2:1	ie95	basic,interpret	παράκλησις ἐν Χριστῷ & παραμύθιον ἀγάπης & κοινωνία Πνεύματος & σπλάγχνα καὶ οἰκτιρμοί	1	Selon vous, pourquoi serait-il important pour les Philippiens de considérer ce qui les **encourage**, les **réconforte**, ce qui les fait participer **ensemble**, ainsi que l'**affection** et la **miséricorde** qu'ils reçoivent dans la communion fraternelle ?		As Paul moves on from discussing the opposition to the gospel that he and the Philippians are experiencing, why would it be important for them to think about the **encouragement**, **comfort**, **fellowship**, **affection**, and **compassion** that they receive from God?
2:2	l020	basic,interpret	τὴν αὐτὴν ἀγάπην ἔχοντες, σύνψυχοι	1	Dans quelle mesure le fait d'avoir **le même amour**, et d'avoir **le même cœur** amènerait-il les Philippiens à être **d'un seul avis** ?		How would **having the same love** and **being united in spirit** cause the Philippians to be **like-minded**?
2:3	c52s	basic,interpret	μηδὲν κατ’ ἐριθείαν μηδὲ κατὰ κενοδοξίαν, ἀλλὰ τῇ ταπεινοφροσύνῃ ἀλλήλους ἡγούμενοι ὑπερέχοντας ἑαυτῶν	1	Dans quelle mesure les deux moitiés de ce verset décrivent-elles des façons opposées de considérer les autres ?		In what way do the two halves of this verse describe opposite ways of thinking about others?
2:3	l022	basic,apply	μηδὲν κατ’ ἐριθείαν μηδὲ κατὰ κενοδοξίαν	1	À votre avis, est-il courant que les gens fassent des choses **par ambition, ou pour gagner une gloire sans valeur** ?		In your opinion, how common is it for people to do things **out of selfish ambition or empty pride**?
2:3	p472	basic,interpret	τῇ ταπεινοφροσύνῃ ἀλλήλους ἡγούμενοι ὑπερέχοντας ἑαυτῶν	1	Pourquoi l'**humilité** est-elle nécessaire pour agir **comme si les autres étaient plus importants que** soi-même ?		Why is **humility** necessary in order to consider **others more important than yourselves**?
2:4	w32h	basic,interpret	μὴ τὰ ἑαυτῶν ἕκαστος σκοποῦντες, ἀλλὰ καὶ τὰ ἑτέρων ἕκαστοι	1	De quels **intérêts** Paul veut-il que les croyants tiennent compte ?		Whose **interests** does Paul want the believers to consider?
2:4	qe48	basic,apply	μὴ τὰ ἑαυτῶν ἕκαστος σκοποῦντες, ἀλλὰ καὶ τὰ ἑτέρων ἕκαστοι	1	D'après votre expérience, comment votre relation avec une personne ou un groupe est-elle différente lorsque vous pensez tous les uns aux autres au lieu de penser uniquement à vous-mêmes ?		In your experience, how is your relationship to a person or group different when you all think about each other instead of just yourselves?
2:5	l024	basic,interpret	τοῦτο φρονεῖτε ἐν ὑμῖν, ὃ καὶ ἐν Χριστῷ Ἰησοῦ	1	Selon vous, ce commandement désigne-t-il le verset 4, les versets 6 à 8, ou les deux ?		Do you think this command refers back to verse 4, or ahead to verses 6-8, or to both?
2:6	l025	basic,interpret	ὃς ἐν μορφῇ Θεοῦ ὑπάρχων & ἴσα Θεῷ	1	Que nous apprennent les expressions **Dieu par son apparence** et **son égalité avec Dieu** sur l'identité de Jésus ?		What does **existing in the form of God** and **equality with God** tell us about who Jesus was?
2:6	j49j	basic,interpret	οὐχ ἁρπαγμὸν ἡγήσατο τὸ εἶναι ἴσα Θεῷ	1	Que nous apprend le fait que Jésus n'ait **pas considéré son égalité avec Dieu comme un droit à conserver** quant à son humilité ?		What does the fact that Jesus chose not to hold on to **equality with God** tell us about his attitude of humility?
2:7	ujs1	basic,interpret	ἑαυτὸν ἐκένωσεν, μορφὴν δούλου λαβών, ἐν ὁμοιώματι ἀνθρώπων γενόμενος & καὶ σχήματι εὑρεθεὶς ὡς ἄνθρωπος	1	Étant égal à Dieu, à quoi Jésus a-t-il renoncé lorsqu'il **a abandonné lui-même son statut** pour devenir un homme ?		Being equal to God, what did Jesus give up to become like a man when He **emptied Himself**?
2:7	asn2	basic,interpret	μορφὴν δούλου λαβών	1	Pourquoi Paul dit-il que Jésus a pris **l'apparence d'un serviteur**, et comment cela s'accorde-t-il avec le commandement de Paul aux Philippiens de considérer les intérêts d'autrui ?		Why does Paul say Jesus took **the form of a servant**, and how does that fit with Paul’s command to the Philippians to consider the needs of others?
2:8	l026	basic,interpret	ἐταπείνωσεν ἑαυτὸν, γενόμενος ὑπήκοος μέχρι θανάτου, θανάτου δὲ σταυροῦ	1	À qui Jésus est-il devenu obéissant lorsqu'il **s'est rabaissé lui-même** ?		To whom did Jesus **become obedient** when **He humbled Himself**?
2:8	l027	basic,interpret	μέχρι θανάτου, θανάτου δὲ σταυροῦ	1	Pourquoi la **mort sur la croix** était-elle considérée comme une mort si cruelle ?		Why was **death on a cross** considered to be such a severe way to die?
