Reference	ID	Tags	Quote	Occurrence	Question	Response	Question
03:20	b9ax	basic,interpret	ἡμῶν & τὸ πολίτευμα ἐν οὐρανοῖς ὑπάρχει	1	Selon vous, pourquoi Paul désigne-t-il les croyants comme des **citoyens des cieux** pour décrire leur relation avec Dieu ?		Why do you think Paul speaks about **citizenship** as a way to describe the believer’s relationship to God?
03:20	l062	basic,apply	ἐξ οὗ καὶ Σωτῆρα ἀπεκδεχόμεθα, Κύριον Ἰησοῦν Χριστόν	1	Dans quelle mesure attendez-vous **avec impatience la venue du ciel du sauveur, le Seigneur Jésus-Christ** ?		To what degree do you also **eagerly await a Savior from there, the Lord Jesus Christ**?
03:21	ka5b	basic,observe	ὃς μετασχηματίσει τὸ σῶμα τῆς ταπεινώσεως ἡμῶν, σύμμορφον τῷ σώματι τῆς δόξης αὐτοῦ	1	Quelle transformation miraculeuse le Christ opérera-t-il lors de son retour ?		What miraculous transformation will Christ make happen when he returns?
03:21	l063	basic,observe	σύμμορφον τῷ σώματι τῆς δόξης αὐτοῦ, κατὰ τὴν ἐνέργειαν τοῦ δύνασθαι αὐτὸν, καὶ ὑποτάξαι αὑτῷ τὰ πάντα	1	Comment le Christ peut-il transformer nos corps terrestres **pour le faire ressembler à son corps glorieux** ?		How is Christ able to transform our earthly bodies into the likeness of **His glorious body**?
4:1	wj5i	basic,observe	ὥστε	1	Ici, **Ainsi** renvoie à la déclaration sommaire de Paul au chapitre 3 sur la condition du croyant. Quelle était cette condition ?		Here **Therefore** refers back to Paul’s summary statement in chapter 3 about the condition of the believer. What was that condition?
4:1	sii5	basic,observe	ἀδελφοί μου ἀγαπητοὶ καὶ ἐπιπόθητοι, χαρὰ καὶ στέφανός μου & ἀγαπητοί	1	Comment Paul s'adresse-t-il aux Philippiens dans ce chapitre ?		How does Paul address the Philippian believers in this chapter?
4:1	ee51	basic,interpret	χαρὰ καὶ στέφανός μου	1	Selon vous, que voulait dire Paul lorsqu'il a affirmé que les Philippiens étaient sa **joie et** sa **couronne** ?		What do you think Paul meant when he said the Philippians were **my joy and crown**?
4:1	bx82	basic,observe	οὕτως στήκετε ἐν Κυρίῳ	1	Quel commandement récapitulatif Paul donne-t-il ici aux Philippiens ?		What summary command does Paul here give to the Philippians?
4:2	v99g	basic,interpret	Εὐοδίαν παρακαλῶ, καὶ Συντύχην παρακαλῶ, τὸ αὐτὸ φρονεῖν ἐν Κυρίῳ	1	Sur la base du commandement de Paul à **Évodie** et **Syntyche**, quel problème pensez-vous que ces deux femmes avaient ?		Based on Paul's command to **Euodia** and **Syntyche**, what problem do you think these two women were having?
4:2	ya5v	basic,interpret	τὸ αὐτὸ φρονεῖν ἐν Κυρίῳ	1	En quoi l'encouragement **à se mettre d'accord dans le Seigneur** vous rappelle-t-il le thème du chapitre 2 de cette lettre ?		In what way does the encouragement here **to agree with each other in the Lord** remind you of the theme of chapter 2 of this letter?
4:3	l064	basic,interpret	σέ, γνήσιε σύνζυγε	1	Nous ne connaissons pas l'identité du **cher collègue**. Certains pensent qu'il s'agit d'un nom personnel. Selon vous, pourquoi Paul s'adresse-t-il ici à cette personne, alors que le reste de la lettre est adressé à tous les croyants de Philippes ?		We do not know the identity of the **true yokefellow**. Some think it is a personal name. Why do you think Paul here addresses this individual, when the rest of the letter is addressed to all the Philippian believers?
4:3	l065	basic,interpret	ναὶ, ἐρωτῶ καὶ σέ, γνήσιε σύνζυγε, συνλαμβάνου αὐταῖς, αἵτινες ἐν τῷ εὐαγγελίῳ συνήθλησάν μοι	1	Selon vous, à la lumière du problème évoqué au verset 2, comment Paul voulait-il que son **cher collègue** aide Évodie et Syntyche ?		In light of the problem in verse 2, how do you think Paul wanted his **true yokefellow** to **help** Euodia and Syntyche?
4:3	r4ka	basic,interpret	ὧν τὰ ὀνόματα ἐν βίβλῳ ζωῆς	1	Pourquoi aurait-ce été un honneur pour ces personnes d'avoir leur nom écrits **dans le livre de vie** ?		Why would it have been an honor for these people to have their names **in the Book of Life**?
4:4	f69c	basic,interpret	χαίρετε ἐν Κυρίῳ πάντοτε, πάλιν ἐρῶ, χαίρετε!	1	En quoi la joie a-t-elle été un thème majeur de toute cette lettre ?		How has **Rejoice** been a major theme of this entire letter?
4:5	t5e8	basic,interpret	τὸ ἐπιεικὲς ὑμῶν γνωσθήτω πᾶσιν ἀνθρώποις	1	Selon vous, pourquoi Paul demande-t-il avec insistance aux Philippiens d'être **raisonnables** ?		Why do you think Paul singled out and emphasized the quality of **gentleness** as a command to the Philippians?
4:5	bnl2	basic,interpret	ὁ Κύριος ἐγγύς	1	En quoi le fait que le Seigneur soit **proche** constitue-t-il une raison d'agir de façon raisonnable devant tous les autres ?		Why would the nearness of **The Lord** be a reason to act with gentleness before all other people?
4:6	k63f	basic,observe	μηδὲν μεριμνᾶτε, ἀλλ’ ἐν παντὶ, τῇ προσευχῇ καὶ τῇ δεήσει μετὰ εὐχαριστίας, τὰ αἰτήματα ὑμῶν γνωριζέσθω πρὸς τὸν Θεόν	1	Selon Paul, que doivent faire les croyants pour ne s'inquiéter **de rien** ?		What specific actions does Paul say believers are to take in order to **Be anxious for nothing**?
4:6	l066	basic,observe	προσευχῇ καὶ τῇ δεήσει μετὰ εὐχαριστίας	1	Selon Paul, quelle attitude doit accompagner **la prière et la supplication** ? Pourquoi ?		According to Paul, what attitude should accompany **prayer and petition**? Why?
4:6	tiu4	basic,interpret	τὰ αἰτήματα ὑμῶν γνωριζέσθω πρὸς τὸν Θεόν	1	Si Dieu sait tout, pourquoi les croyants devraient-ils faire **connaître** leurs **besoins à Dieu** ?		God knows everything. So why should believers **present** their **requests to God**?
4:7	uq3j	basic,interpret	ἡ εἰρήνη τοῦ Θεοῦ ἡ ὑπερέχουσα πάντα νοῦν	1	Que veut dire Paul lorsqu'il affirme que **la paix de Dieu** **est plus grande que notre compréhension** ?		What does Paul mean when he says that **the peace of God** **surpasses all understanding**?
4:7	h54t	basic,interpret	ἡ εἰρήνη τοῦ Θεοῦ & φρουρήσει τὰς καρδίας ὑμῶν καὶ τὰ νοήματα ὑμῶν ἐν Χριστῷ Ἰησοῦ	1	Quelle est la différence entre le cœur et la pensée, et comment la paix de Dieu peut-elle les protéger tous les deux ?		What is the difference between **hearts** and **minds**, and how would the **peace of God** be able to guard both?
4:8	u9db	basic,observe	ὅσα ἐστὶν ἀληθῆ, ὅσα σεμνά, ὅσα δίκαια, ὅσα ἁγνά, ὅσα προσφιλῆ, ὅσα εὔφημα, εἴ τις ἀρετὴ, καὶ εἴ τις ἔπαινος, ταῦτα λογίζεσθε	1	Quelles sont les 8 qualités que Paul énumère pour décrire les choses auxquelles nous devrions penser ?		What are the eight positive qualities that Paul lists to describe the kind of things that we should think about?
4:8	kf73	basic,interpret	ὅσα ἐστὶν ἀληθῆ, ὅσα σεμνά, ὅσα δίκαια, ὅσα ἁγνά, ὅσα προσφιλῆ, ὅσα εὔφημα, εἴ τις ἀρετὴ, καὶ εἴ τις ἔπαινος, ταῦτα λογίζεσθε	1	Comprenez-vous que Paul dit que nous devrions penser à des choses qui ont toutes ces qualités, ou à n'importe quelle chose qui a l'une de ces qualités ?		Do you understand Paul to say that we should think about things with all of these qualities, or about any thing that has one of these qualities?
4:9	gc1e	basic,apply	ἃ καὶ ἐμάθετε καὶ παρελάβετε, καὶ ἠκούσατε καὶ εἴδετε, ἐν ἐμοί, ταῦτα πράσσετε	1	Dans quelle mesure pourriez-vous honnêtement dire aux gens qu'ils seraient agréables à Dieu s'ils mettaient **en pratique** ce qu'ils ont **appris, reçu, entendu et vu** en vous ?		To what degree could you honestly tell people that they would please God if they would do **Whatever you have learned or received or heard from me, or seen in me**?
4:9	g8rc	basic,observe	ὁ Θεὸς τῆς εἰρήνης ἔσται μεθ’ ὑμῶν	1	Selon Paul, que se passera-t-il si les Philippiens pensent à ce qui est digne et suivent l'exemple de Paul ?		According to Paul, what will happen if the Philippians think about worthy things and follow Paul’s example?
04:10	vxj4	basic,interpret	ἐχάρην δὲ ἐν Κυρίῳ μεγάλως	1	Selon vous, pourquoi Paul parle-t-il à nouveau ici de la joie - un thème central de sa lettre ?		Why do you think Paul here again speaks about rejoicing—a central theme of his letter?
04:10	jp51	basic,observe	ἐχάρην δὲ ἐν Κυρίῳ μεγάλως, ὅτι ἤδη ποτὲ ἀνεθάλετε τὸ ὑπὲρ ἐμοῦ φρονεῖν	1	Pourquoi Paul se réjouit-il autant ?		What is that reason that Paul is greatly rejoicing?
4:10, 18	l067	basic,observe	ἤδη ποτὲ ἀνεθάλετε τὸ ὑπὲρ ἐμοῦ φρονεῖν; ἐφ’ ᾧ καὶ ἐφρονεῖτε, ἠκαιρεῖσθε δέ & δεξάμενος παρὰ Ἐπαφροδίτου τὰ παρ’ ὑμῶν	1	Quelle **occasion** les Philippiens ont-ils eue de renouveler leur préoccupation au nom de Paul ?		What was the **opportunity** that the Philippians had which allowed them to renew their concern on Paul’s behalf?
04:11	hgz7	basic,observe	ἐγὼ γὰρ ἔμαθον ἐν οἷς εἰμι, αὐτάρκης εἶναι	1	Qu'est-ce que Paul a appris sur le contentement?		What has Paul learned about being **content**?
04:12	zhr5	basic,observe	οἶδα καὶ ταπεινοῦσθαι, οἶδα καὶ περισσεύειν. ἐν παντὶ καὶ ἐν πᾶσιν μεμύημαι, καὶ χορτάζεσθαι καὶ πεινᾶν, καὶ περισσεύειν καὶ ὑστερεῖσθαι	1	Quelles sont les trois paires de mots que Paul utilise pour décrire les situations extrêmes qu'il a vécues ?		What three different pairs of terms does Paul use to describe the extreme situations which he has experienced?
04:12	k3fv	basic,interpret	οἶδα & μεμύημαι	1	De quelle manière Paul indique-t-il qu'il a acquis ces connaissances par une expérience personnelle sur une certaine durée ?		In what way does Paul indicate that he gained this knowledge by personal experience over a period of time?
04:13	tg6y	basic,interpret	πάντα ἰσχύω	1	Dans le contexte du verset 12, à quoi l'expression **toutes les situations** renvoie-t-elle ?		In the context of verse 12, to what would **all things** refer back?
04:13	gsy2	basic,observe	ἐν τῷ ἐνδυναμοῦντί με	1	Qu'est-ce qui donne à Paul **la force pour supporter toutes les situations** ?		What enables Paul to do **all things**?
04:14	l37l	basic,observe	πλὴν καλῶς ἐποιήσατε, συνκοινωνήσαντές μου τῇ θλίψει	1	Qu'ont fait les Philippiens de si appréciable pour Paul ?		What did the Philippians do for Paul that he appreciated?
04:15	xng2	basic,observe	οὐδεμία μοι ἐκκλησία ἐκοινώνησεν εἰς λόγον δόσεως καὶ λήμψεως, εἰ μὴ ὑμεῖς μόνοι	1	Quel acte les Philippiens ont-ils accompli qui était unique pour une église de l'époque ?		What had the Philippians done that was unique for a church at that time?
04:16	ze9y	basic,observe	ὅτι καὶ ἐν Θεσσαλονίκῃ, καὶ ἅπαξ καὶ δὶς, εἰς τὴν χρείαν μοι ἐπέμψατε	1	Qu'ont fait les Philippiens pour Paul alors qu'il était à Thessalonique ?		What did the Philippians do for Paul when he was in Thessalonica?
04:17	l068	basic,interpret	οὐχ ὅτι ἐπιζητῶ τὸ δόμα	1	Paul veut-il dire qu'il ne voulait pas que les Philippiens le soutiennent financièrement ?		Is Paul saying that he did not want the Philippians to support him financially?
04:17	ijs2	basic,observe	οὐχ ὅτι ἐπιζητῶ τὸ δόμα, ἀλλὰ ἐπιζητῶ τὸν καρπὸν τὸν πλεονάζοντα εἰς λόγον ὑμῶν	1	Pourquoi Paul était-il plus heureux du fait que les Philippiens aient fait un don que du don lui-même ?		Why was Paul more pleased by the fact that the Philippians gave than he was with the actual gift?
04:18	pb8u	basic,observe	ἀπέχω δὲ πάντα, καὶ περισσεύω; πεπλήρωμαι, δεξάμενος παρὰ Ἐπαφροδίτου τὰ παρ’ ὑμῶν	1	Dans quel état se trouvait Paul à la suite du don que les Philippiens lui ont fait par l'intermédiaire d'Épaphrodite ?		What was Paul’s current condition as a result of the gift the Philippians sent via **Epaphroditus**?
04:18	s51c	basic,observe	τὰ παρ’ ὑμῶν, ὀσμὴν εὐωδίας, θυσίαν δεκτήν, εὐάρεστον τῷ Θεῷ	1	Selon Paul, comment Dieu a-t-il considéré le don que les Philippiens ont envoyé à Paul ?		According to Paul, how did God view the gift the Philippians sent to Paul?
04:19	nt8x	basic,observe	ὁ δὲ Θεός μου πληρώσει πᾶσαν χρείαν ὑμῶν, κατὰ τὸ πλοῦτος αὐτοῦ ἐν δόξῃ ἐν Χριστῷ Ἰησοῦ	1	Selon Paul, comment Dieu répondra-t-il aux Philippiens suite au don qu'ils ont envoyé à Paul ?		According to Paul, how will God respond to the Philippians because they sent the gift to Paul when he was in need?
04:19	ty2j	basic,interpret	ὁ δὲ Θεός μου πληρώσει πᾶσαν χρείαν ὑμῶν	1	Ici, **Et** relie la promesse de Paul au verset précédent. Comment la promesse que Dieu va les bénir est-elle liée au don sacrificiel des Philippiens ?		Here **And** connects Paul’s promise to the previous verse. How is the promise of God’s blessing therefore connected to the sacrificial giving of the Philippians?
04:19	l069	basic,observe	κατὰ τὸ πλοῦτος αὐτοῦ ἐν δόξῃ ἐν Χριστῷ Ἰησοῦ	1	À quelle hauteur Dieu répondra-t-il aux besoins des Philippiens ?		What is the measure by which God will meet the needs of the Philippians?
04:20	ee3q	basic,observe	τῷ δὲ Θεῷ καὶ Πατρὶ ἡμῶν ἡ δόξα εἰς τοὺς αἰῶνας τῶν αἰώνων	1	En fin de compte, à qui doit revenir la **gloire** pour le service de Paul, les dons des Philippiens et la provision des besoins des Philippiens ?		Who ultimately should receive **glory** for Paul’s service, the giving of the Philippians, and the provision for the needs of the Philippians?
04:21	yuu2	basic,interpret	ἀσπάσασθε πάντα ἅγιον ἐν Χριστῷ Ἰησοῦ	1	Qui Paul demande-t-il aux Philippiens de saluer ?		Who does Paul ask the Philippians to greet?
4:21-22	z2he	basic,observe	ἀσπάζονται ὑμᾶς οἱ σὺν ἐμοὶ ἀδελφοί & ἀσπάζονται ὑμᾶς πάντες οἱ ἅγιοι, μάλιστα δὲ οἱ ἐκ τῆς Καίσαρος οἰκίας	1	Qui a également envoyé des salutations aux saints de Philippes ?		Who also sent greetings to the saints in Philippi?
04:22	d8g6	basic,interpret	ἀσπάζονται ὑμᾶς πάντες οἱ ἅγιοι, μάλιστα δὲ οἱ ἐκ τῆς Καίσαρος οἰκίας	1	Alors que Paul était jugé à Rome, comment les membres de la **maison de César** ont-ils pu devenir des **saints** ?		As Paul was on trial in Rome, how might members of **the household of Caesar** have become **saints**?
04:23	l070	basic,observe	ἡ χάρις τοῦ Κυρίου Ἰησοῦ Χριστοῦ μετὰ τοῦ πνεύματος ὑμῶν	1	Quelle était la chose la plus importante que Paul voulait que Jésus accorde aux Philippiens ?		What was the most important thing Paul wanted Jesus to provide to the Philippians?