TIT	3	11	inh5	TIT_3_11_inh5	ἐξέστραπται	Paul parle de quelqu’un qui choisit de faire de mauvaises choses comme d’une personne qui quitte le bon chemin pour marcher dans la mauvaise direction. (Voir : [[rc://fr/ta/man/translate/figs-metaphor]])
TIT	3	11	p81k	TIT_3_11_p81k	ὢν αὐτοκατάκριτος	Traduction alternative : “porte judgment sur elle-même”
TIT	3	12	z7i4	TIT_3_12_z7i4		Paul termine la lettre en disant à Tite ce qu’il doit faire après avoir nommé des anciens en Crète et en transmettant les salutations de ceux qui sont avec lui.
TIT	3	12	mba6	TIT_3_12_mba6	ὅταν πέμψω	Traduction alternative : “Lorsque je t’aurai envoyé”
TIT	3	12	c32w	TIT_3_12_c32w	Ἀρτεμᾶν…Τυχικόν	Ce sont des noms d’hommes. (See: [[rc://fr/ta/man/translate/translate-names]])
TIT	3	12	knt1	TIT_3_12_knt1	σπούδασον ἐλθεῖν	Traduction alternative : “dépêchez-vous de venir”
TIT	3	12	xy30	TIT_3_12_xy30	σπούδασον	Le verbe est singulier et dirigé vers Tite seul. Artémas ou Tychique resterait en Crète, probablement pour prendre la place de Tite.
TIT	3	12	gdw9	TIT_3_12_gdw9	παραχειμάσαι	Paul dit à Tite qu’il a décidé de rester à Nicopolis pendant l’hiver. Traduction alternative : “d’y rester pour l’hiver”
TIT	3	13	a46f	TIT_3_13_a46f	Ζηνᾶν…Ἀπολλῶν	Ce sont des noms d’hommes. (Voir : [[rc://fr/ta/man/translate/translate-names]])
TIT	3	13	s757	TIT_3_13_s757	καὶ Ἀπολλῶν	Traduction alternative : “et aussi Apollos”
TIT	3	13	j496	TIT_3_13_j496	σπουδαίως πρόπεμψον	Paul veut que Tite prenne soin des préparations de voyage pour Zénas et Appolos. Traduction alternative : “prend soin de m’envoyer”
TIT	3	13	xy31	TIT_3_13_xy31	ἵνα μηδὲν αὐτοῖς λείπῃ	Vous pouvez le dire positivement : “afin qu’ils aient tout ce dont ils ont besoin” (Voir : \[rc://fr/ta/man/translate/figs-doublenegatives\])
TIT	3	14	v7wg	TIT_3_14_v7wg		Paul explique qu’il est important pour tous les croyants de subvenir au nécessaire de ceux qui ont des besoins.
TIT	3	14	fw98	TIT_3_14_fw98	οἱ ἡμέτεροι	Paul fait référence aux croyants en Crète. Traduction alternative : “ceux de nos assemblées”
TIT	3	14	xy33	TIT_3_14_xy33	οἱ ἡμέτεροι	Ici, **les nôtres** s’applique aux croyants à qui Paul et Tite demandent à pratiquer de bonnes œuvres. La forme devrait être inclusive. (Voir : [[rc://fr/ta/man/translate/figs-exclusive]])
TIT	3	14	tn24	TIT_3_14_tn24	εἰς τὰς ἀναγκαίας χρείας	Traduction alternative : “leur permettant d’aider les gens qui manquent de choses nécessaires”
TIT	3	14	mji4	TIT_3_14_mji4	ἵνα μὴ ὦσιν ἄκαρποι	Paul parle des gens qui font du bon travail comme s’ils étaient des arbres portant de bons fruits. Traduction alternative : “afin qu’ils ne mènent pas des vies inutiles” (Voir : [rc://fr/ta/man/translate/figs-metaphor])
TIT	3	14	xy32	TIT_3_14_xy32	ἵνα μὴ ὦσιν ἄκαρποι	Vous pouvez le dire positivement : “de cette façon ils seront fructueux” ou “de cette façon ils seront productifs” (Voir : [rc://fr/ta/man/translate/figs-doublenegatives])
TIT	3	15	j3y2	TIT_3_15_j3y2		Paul termine sa lettre à Tite.
TIT	3	15	abci	TIT_3_15_abci	ἀσπάζονταί σε	Ici, **te** est singulier – c’est une salutation personnelle à Tite.
TIT	3	15	k1sa	TIT_3_15_k1sa	οἱ μετ’ ἐμοῦ πάντες	Traductions alternatives : “Tous les gens qui sont avec moi” ou “Tous les croyants qui sont ici, avec moi”
TIT	3	15	f4vc	TIT_3_15_f4vc	τοὺς φιλοῦντας ἡμᾶς ἐν πίστει	Deux sens sont possibles: Traductions alternatives : (1) “les croyants qui nous aiment” (2) “les croyants qui nous aiment parce que nous partageons la même foi”.
TIT	3	15	xy35	TIT_3_15_xy35	ἡμᾶς	Ici, **nous** est probablement exclusif et se réfère à Paul et au groupe de chrétiens avec lui. Paul envoie les salutations de ce groupe aux chrétiens qui sont avec Tite en Crète. (Voir : [rc://fr/ta/man/translate/figs-exclusive])
TIT	3	15	kx83	TIT_3_15_kx83	ἡ χάρις μετὰ πάντων ὑμῶν	C’était une salutation chrétienne courante. Traduction alternative : “Que la grâce de Dieu soit avec vous” ou “Je prie Dieu d’être miséricordieux envers vous tous”
TIT	3	15	xy34	TIT_3_15_xy34	ὑμῶν	Ici, **vous** est pluriel. Cette bénédiction est pour Titus et tous les croyants en Crète.
