TIT	2	2	y3j2	TIT_2_2_y3j2	εἶναι…σώφρονας	L’adjectif **raisonnable** s’applique a un homme qui pense et agit avec bon sens, qui réfléchit avant d’agir. Traduction alternative : “doivent être… capable de contrôler leurs désirs”
TIT	2	2	abc1	TIT_2_2_abc1	ὑγιαίνοντας τῇ πίστει	Ici, le mot **accompli** signifie être parfait, ferme et inébranlable. Voir la note sur **de bons enseignements** à [Titus 1:9](../01/09/pzi1) et la note sur **solides dans leur foi** à \[Titus 1:13\](../01/ 13/je3r).
TIT	2	2	m14y	TIT_2_2_m14y	ὑγιαίνοντας τῇ πίστει	Vous pouvez utiliser le nom abstrait “la foi” comme un verbe si c’est plus clair dans votre langue. Traduction alternative : “des hommes qui croient totalement aux vrais enseignements au sujet de Dieu” (Voir : \[rc://fr/ta/man/translate/figs-abstractnouns\])
TIT	2	2	z14y	TIT_2_2_z14y	τῇ ἀγάπῃ	Vous pouvez utiliser le nom abstrait “amour” comme un verbe si cela est plus clair dans votre langue comme dans le GST. (Voir : \[rc://fr/ta/man/translate/figs-abstractnouns\])
TIT	2	2	a14y	TIT_2_2_a14y	τῇ ὑπομονῇ	Vous pouvez remplacer le nom abstrait **persévérance** par un verbe si cela est plus clair dans votre langue. Par exemple : “et persévérer au service de Dieu même lorsque c’est difficile”. (Voir : \[rc://fr/ta/man/translate/figs-abstractnouns\])
TIT	2	3	gl8e	TIT_2_3_gl8e	πρεσβύτιδας ὡσαύτως	Le Grec n’a pas l’expression **doivent être**, mais seulement “des femmes plus âgées de même”. Nous devons continuer l’idée d’enseigner et exhorter venant des deux versets précédents et l’appliquer ici aussi. Traductions alternatives : “De la même manière, enseignez que les femmes plus âgées” ou “Enseignez aussi aux femmes plus âgées qu’elles” (Voir : \[rc://fr/ta/man/translate/figs-ellipsis\])
TIT	2	3	v9cp	TIT_2_3_v9cp	διαβόλους	Cet adjectif fait référence aux gens qui disent de mauvaises choses au sujet d’autres personnes, qu’elles soient vraies ou non.
TIT	2	3	g9re	TIT_2_3_g9re	οἴνῳ πολλῷ δεδουλωμένας	L’expression “asservies à trop de vin” parle des gens qui ne peuvent pas se contrôler et boivent trop de vin comme s’ils étaient esclaves du vin. Voici d’autres façons de dire cela : “contrôlé par leur désir de boire du vin” ou “accro au vin” (Voir : [rc://fr/ta/man/translate/figs-metaphor])
TIT	2	3	xyz4	TIT_2_3_xyz4	οἴνῳ πολλῷ δεδουλωμένας	Vous pouvez déclarer cela à la voix active. Traductions alternatives : “buvant trop de vin” ou “ accros au vin” (Voir : [rc://fr/ta/man/translate/figs-activepassive])
TIT	2	3	abc4	TIT_2_3_abc4	καλοδιδασκάλους	Le mot grec utilisé ici signifie “un maître de ce qui est bon”. Le groupe de mots “mais doivent être” est implicite dans l’expression **mais enseignantes de ce qui est bon** qui contraste cette bonne qualité avec les deux mauvaises qualités précédentes. Considérez l’utilisation d’une expression de contraste comme “mais elles doivent être” ou “au lieu de cela, elles doivent être” pour faire un contraste entre les bonnes et les mauvaises qualités dans votre langue.
TIT	2	4	abc5	TIT_2_4_abc5	φιλάνδρους	Paul dit à Tite qu’íl veut que, par leur comportement, les femmes plus âgées enseignent aux jeunes femmes “d’être les amants de leurs propres maris”.
TIT	2	4	abca	TIT_2_4_abca	φιλοτέκνους	Paul dit à Tite qu’il veut aussi que, par leur comportement, les femmes plus âgées enseignent aux jeunes femmes d’aimer leurs propres enfants.
TIT	2	5	abcb	TIT_2_5_abcb	ὑποτασσομένας τοῖς ἰδίοις ἀνδράσιν	Le terme “être soumises” veut dire obéir de bon gré, volontairement. Donc, on peut dire en traduction alternative : “à obéir de bon gré à leurs maris”.
TIT	2	5	t5v6	TIT_2_5_t5v6	ἵνα μὴ ὁ λόγος τοῦ Θεοῦ βλασφημῆται	Ici, **la Parole** est une métonymie de « message », qui à son tour est un synonyme pour Dieu lui-même. (Voir : [rc://fr/ta/man/translate/figs-metonymy])
TIT	2	5	abcq	TIT_2_5_abcq	ἵνα μὴ ὁ λόγος τοῦ Θεοῦ βλασφημῆται	Vous pouvez déclarer le passage surligné sous forme active. Traductions alternatives : “pour que personne n’insulte la Parole de Dieu” ou “pour que personne n’insulte Dieu en disant du mal de son message” (Voir : \[rc://fr/ta/man/translate/figs-activepassive\])
TIT	2	6	i3hv	TIT_2_6_i3hv	ὡσαύτως	Tite devait former les jeunes hommes tout comme il devait former les personnes âgées. Traduction alternative : “De la même manière”
TIT	2	7	x73u	TIT_2_7_x73u	σεαυτὸν παρεχόμενος	Si c’est plus clair dans votre langue, utilisez la traduction alternative : “montre-toi” ou “tu dois être”.
TIT	2	7	ym6x	TIT_2_7_ym6x	τύπον καλῶν ἔργων	Traduction alternative : “comme un exemple de quelqu’un qui fait des actions bonnes”
TIT	2	8	xy14	TIT_2_8_xy14	ὑγιῆ	Ce mot **solide** a la même signification de base que “pas corrompu” dans 2:7. Là, Paul donne la signification négativement : “pas corrompu”, signifiant “sans erreur”, mais dans 2:8, il donne le sens positivement : **solide**, signifiant “correct”. Les deux termes se réfèrent à l’enseignement de Tite. Utilisez des termes positifs ou négatifs dans la langue cible. S’il est difficile d’utiliser deux termes, utilisez un seul terme ayant le même sens dans les deux versets.
TIT	2	8	xt6v	TIT_2_8_xt6v	ἵνα ὁ ἐξ ἐναντίας ἐντραπῇ	Cela présente une situation hypothétique dans laquelle quelqu’un s’oppose à Titus et devient ensuite honteux de l’avoir fait. Traductions alternatives : « afin que, si quelqu’un s’oppose à vous, il ait honte » ou « afin que lorsque les gens s’opposent à vous, ils aient honte » (Voir : [[rc://fr/ta/man/translate/figs- hypo]])
TIT	2	8	xy15	TIT_2_8_xy15	ἡμῶν	Le pronom complément d’object indirect “nous” parle de Paul, de Tite, et de tous les Chrétiens. (Voir : [[rc://fr/ta/man/translate/figs-exclusive]])
TIT	2	9	xyz5	TIT_2_9_xyz5	δούλους ἰδίοις δεσπόταις ὑποτάσσεσθαι	Le Grec n’a pas le terme **doivent être**, mais seulement “des esclaves à soumettre à leurs maîtres”. Nous devons appliquer l’idée verbale du verset 6 à ce passage, c’est-à-dire “recommander” ou “exhorter”. Traduction alternative : “Recommande aux esclaves de se soumettrent à leurs maîtres” (Voir : \[rc://fr/ta/man/translate/figs-ellipsis\])
TIT	2	9	abcc	TIT_2_9_abcc	ὑποτάσσεσθαι	Il pourrait être plus clair dans votre langue d’éviter la construction qui ne se trouve pas dans le grec “doivent être”. Traduction alternative : “doivent obéir”
TIT	2	9	if6v	TIT_2_9_if6v	ἐν πᾶσιν	Peut-être qu’ **en toute chose** n’est pas clair dans votre langue, essayez une des traductions alternatives : “dans chaque situation” ou “toujours”
TIT	2	9	id15	TIT_2_9_id15	εὐαρέστους εἶναι	On peut réécrire le verset 2:9 comme suit pour éviter la voix passive. Les esclaves doivent obéir à leurs propres maîtres en toute chose. Traduction alternative : “faire plaisir à leurs maîtres”.
TIT	2	10	abc6	TIT_2_10_abc6	μὴ νοσφιζομένους	Traduction alternative : “ne rien voler de leurs maîtres”
TIT	2	10	t87j	TIT_2_10_t87j	πᾶσαν πίστιν ἐνδεικνυμένους ἀγαθήν	Paul dit à Tite d’enseigner aux esclaves de montrer qu’ils doivent “être dignes de la confiance de leurs maîtres”.
TIT	2	10	h2n6	TIT_2_10_h2n6	ἐν πᾶσιν	**En toute choses** est un synonyme de “dans toutes les choses” qui signifie “dans tout ce qu’ils vont faire” dans le contexte de ce verset. Traduction alternative : “dans tout ce qu’ils vont faire”
TIT	2	10	f8jy	TIT_2_10_f8jy	τὴν διδασκαλίαν τὴν τοῦ Σωτῆρος ἡμῶν, Θεοῦ, κοσμῶσιν	Traductions alternatives : “pourra faire honneur à l’enseignement qui est au sujet de Dieu notre Sauveur” ou “amènera les gens à comprendre que l’enseignement sur Dieu notre Sauveur doit être respecté”
TIT	2	10	pn93	TIT_2_10_pn93	Σωτῆρος ἡμῶν, Θεοῦ	Traduction alternative: “notre Dieu qui nous sauve”
TIT	2	10	xy16	TIT_2_10_xy16	ἡμῶν	L’emploi du pronom possessif **votre** nous dit que Dieu, le Sauveur appartient à Paul, Tite et à tous les Chrétiens  (Voir : [[rc://fr/ta/man/translate/figs-exclusive]])
TIT	2	11	y44u	TIT_2_11_y44u		Paul encourage Tite à attendre avec impatience la venue de Jésus et à se rappeler que son autorité est venue de Jésus.
TIT	2	11	gp2z	TIT_2_11_gp2z	ἐπεφάνη…ἡ χάρις τοῦ Θεοῦ	Paul parle de la grâce de Dieu comme si c’était une personne qui est arrivée. Voir le GST pour d’autres façons d’exprimer cela ou bien considérer la traduction alternative : “Dieu offre maintenant sa grâce” (Voir : [[rc://fr/ta/man/translate/figs-personification]])
TIT	2	12	qy8k	TIT_2_12_qy8k	παιδεύουσα ἡμᾶς	Paul parle de la grâce de Dieu (2:11) comme s’il s’agissait d’une personne qui nous apprend à vivre une vie sainte. Traduction alternative : “par laquelle Dieu nous forme” (Voir : [[rc://fr/ta/man/translate/figs-personification]])
TIT	2	12	abce	TIT_2_12_abce	ἡμᾶς	Le pronom personnel “nous” inclut Paul, Tite, et tous les Chrétiens. (Voir : [[rc://fr/ta/man/translate/figs-exclusive]])
TIT	2	12	lxb3	TIT_2_12_lxb3	τὴν ἀσέβειαν	Paul dit à Tite que la grâce de Dieu nous apprend à rejeter “le mépris que les gens ont pour Dieu”.
TIT	2	12	n3k5	TIT_2_12_n3k5	τὰς κοσμικὰς ἐπιθυμίας	“les désirs intenses pour les choses de ce monde” ou “les désirs pour les plaisirs du péché”
TIT	2	12	xy19	TIT_2_12_xy19	ἀσέβειαν…εὐσεβῶς	Ce qui est **mauvais**, l’impiété, n’honore pas Dieu. Mais **lui obéir**, la justice, honore Dieu. Ces deux phrases présentent des idées qui contrastent la vie des gens qui honorent Dieu avec celle des gens qui le déshonorent.
TIT	2	12	fk8j	TIT_2_12_fk8j	ἐν τῷ νῦν αἰῶνι	“la période de temps pendant laquelle nous vivons dans ce monde” ou “pendant notre vie”
TIT	2	13	rz93	TIT_2_13_rz93	προσδεχόμενοι	Traduction alternative : “pendant que nous attendons”
TIT	2	13	xyz6	TIT_2_13_xyz6	τὴν μακαρίαν ἐλπίδα	Ici, ce qui est **bienheureux** est ce que nous espérons, le retour de Jésus-Christ. Traduction alternative : “l’événement merveilleux que nous espérons” (Voir : [[rc://fr/ta/man/translate/figs-metonymy]])
TIT	2	13	pss7	TIT_2_13_pss7	καὶ ἐπιφάνειαν τῆς δόξης τοῦ μεγάλου Θεοῦ καὶ Σωτῆρος ἡμῶν, Ἰησοῦ Χριστοῦ	La **gloire** représente Jésus lui-même qui apparaîtra glorieusement. Traduction alternative : “c’est-à-dire l’apparition glorieuse de notre grand Dieu et Sauveur Jésus-Christ” (Voir : [[rc://fr/ta/man/translate/figs-metonymy]])
TIT	2	13	abcf	TIT_2_13_abcf	τὴν μακαρίαν ἐλπίδα, καὶ ἐπιφάνειαν τῆς δόξης	**La bienheureuse espérance** et **l’apparition de la gloire** font référence au même événement. Cela peut être démontré clairement. Traduction alternative : “ce que nous espérons, l’apparition bénie et glorieuse” (Voir : [[rc://fr/ta/man/translate/figs-hendiadys]])
TIT	2	13	xyz7	TIT_2_13_xyz7	τοῦ μεγάλου Θεοῦ καὶ Σωτῆρος ἡμῶν, Ἰησοῦ Χριστοῦ	**notre grand Dieu** et **Sauveur** font tous deux référence à une seule personne, Jésus-Christ. Traduction alternative : “de Jésus-Christ, notre grand Dieu et Sauveur” (Voir : [[rc://fr/ta/man/translate/figs-hendiadys]])
TIT	2	14	niu4	TIT_2_14_niu4	ἔδωκεν ἑαυτὸν ὑπὲρ ἡμῶν	Il s’agit de la mort volontaire de Jésus. Traduction alternative : “s’est donné lui-même pour mourir à notre place” (Cf. [rc://fr/ta/man/translate/figs-explicit])
TIT	2	14	xy20	TIT_2_14_xy20	ἡμῶν	Le pronom personnel complément d’objet indirect “nous” signifie “chaque personne” dont on parle, y compris Paul, Tite, et tous les Chrétiens. (Voir : [[rc://fr/ta/man/translate/figs-exclusive]])
TIT	2	14	gxe7	TIT_2_14_gxe7	λυτρώσηται ἡμᾶς ἀπὸ πάσης ἀνομίας	Paul parle de ce que Jésus fait pour nous comme s’il libérait des esclaves de leurs mauvais maîtres. (Voir : [[rc://fr/ta/man/translate/figs-metaphor]])
TIT	2	14	xy21	TIT_2_14_xy21	ἡμᾶς	Le pronom **nous** comprend Paul, Titus et tous les Chrétiens. (Voir : [rc://fr/ta/man/translate/figs-exclusive])
TIT	2	14	fjy1	TIT_2_14_fjy1	λαὸν περιούσιον	Paul dit aussi qu’**un peuple spécial** repésente le peuple de croyants que Dieu a choisi, qu’il a pris pour lui-même, le peuple de Dieu, pour lequel Jésus Christ a donné sa vie. Traduction alternative : “un groupe de personnes qui compte tellement à Jésus”
TIT	2	14	ii18	TIT_2_14_ii18	ζηλωτὴν καλῶν ἔργων	Traduction alternative : “qui désirent vivement de faire de bonnes actions”
TIT	2	15	abc7	TIT_2_15_abc7	παρακάλει	Paul veut que Tite “pousse les croyants à faire tout ce qu’il a écrit”
TIT	2	15	b94z	TIT_2_15_b94z	ἔλεγχε, μετὰ πάσης ἐπιταγῆς	Si c’est utile, on peut rendre explicites les personnes que Titus doit corriger. Traduction alternative : “corrige avec toute autorité les gens qui ne font pas toutes ces choses” (Voir : [[rc://fr/ta/man/translate/figs-explicit]])
TIT	2	15	h15y	TIT_2_15_h15y	μηδείς σου περιφρονείτω	Traduction alternatives : “Ne permets à personne de t’ignorer” ou “Ne permets à personne d’être indifférent à ce que tu dis”
TIT	2	15	xy22	TIT_2_15_xy22	μηδείς σου περιφρονείτω	Vous pouvez le dire positivement : “Assure-toi que tout le monde t’écoute” (Voir : [rc://fr/ta/man/translate/figs-doublenegatives])
TIT	2	15	jbu1	TIT_2_15_jbu1	σου περιφρονείτω	On peut rendre explicite la façon dont les gens ne prêterait pas attention à Tite. Traduction alternative : “Ne permets à personne de refuser d’écouter ce que tu dis” ou “Ne permets à personne de refuser de te respecter” (Voir : [[rc://fr/ta/man/translate/figs-explicit]])
TIT	3	intro	zh6x	TIT_3_intro_zh6x		# Tite 3 Remarques générales<br><br>## Structure et mise en forme<br><br>Paul donne des instructions personnelles à Tite dans ce chapitre.<br><br>Le verset 15 termine formellement cette lettre. C’est une façon classique de terminer une lettre dans l’ancien Proche-Orient.<br><br>## Concepts particuliers de ce chapitre<br><br>### généalogies<br><br>Les généalogies (verset 9) sont des séries d’ancêtres ou de descendants qui établissent une filiation. Elles montrent de quelle tribu et de quelle famille une personne est issue. Par exemple, les prêtres venaient de la tribu de Lévi et de la famille d’Aaron. Certaines de ces listes comprenaient des histoires d’ancêtres et même d’êtres spirituels qui étaient utilisées pour discuter d’où venaient les traditions et croyances et l’importance de diverses personnes.
TIT	3	1	y9tr	TIT_3_1_y9tr		Paul continue de donner à Tite des instructions sur la façon d’enseigner aux anciens et aux gens dont il a la charge à Crète.
TIT	3	1	j2sa	TIT_3_1_j2sa	ὑπομίμνῃσκε αὐτοὺς…ὑποτάσσεσθαι	“Répète à tous ce qu’ils savent déjà ; ils doivent se soumettre aux” ou “Continue de leur rappeler de soumettre aux”
TIT	3	1	w3fy	TIT_3_1_w3fy	ἀρχαῖς, ἐξουσίαις, ὑποτάσσεσθαι, πειθαρχεῖν	Traduction alternative : “de faire ce que disent les dirigeants politiques et les autorités gouvernementales, de leur obéir”
TIT	3	1	wa9x	TIT_3_1_wa9x	ἀρχαῖς, ἐξουσίαις	Les mots dirigeants et autorités ont des significations semblables et tous deux se réfèrent à quiconque détient l’autorité dans le gouvernement. Si la langue cible n’a qu’un seul terme pour cela, il suffira d’utiliser ce terme (voir [[rc://fr/ta/man/translate/figs-doublet]])
TIT	3	1	xy25	TIT_3_1_xy25	ὑποτάσσεσθαι, πειθαρχεῖν	Ces deux verbes ont des significations semblables et tous deux disent de faire ce que quelqu’un vous dit de faire. Si la langue cible n’a qu’un seul terme pour cela, il suffira d’utiliser ce terme (voir [[rc://fr/ta/man/translate/figs-doublet]])
TIT	3	1	in7u	TIT_3_1_in7u	πρὸς πᾶν ἔργον ἀγαθὸν ἑτοίμους εἶναι	Traduction alternative : “d’être toujours prêts à faire tout ce qui est bien”
TIT	3	2	lug7	TIT_3_2_lug7	βλασφημεῖν	Traduction alternative : “de… insulter”
TIT	3	2	abcx	TIT_3_2_abcx	ἀμάχους εἶναι	Vous pouvez le dire positivement : “être tolérant” (Voir : [[rc://fr/ta/man/translate/figs-doublenegatives]])
TIT	3	3	m9zd	TIT_3_3_m9zd	ἦμεν γάρ ποτε καὶ ἡμεῖς	“C’est parce que nous aussi, nous avons été nous-mêmes”.
TIT	3	3	me7b	TIT_3_3_me7b	ποτε	Traductions alternatives : “dans le temps passé”, “il y a longtemps” ou “auparavant” ou “bien avant cela”
TIT	3	3	bl8e	TIT_3_3_bl8e	ἡμεῖς	Dans cette phrase, le pronom, “nous”, signifie “même nous” ou “nous-mêmes”. Paul veut que Tite comprenne qu’il se réfère au temps quand lui-même, Tite et tous les chrétiens ne se confiaient pas encore en Christ. (Voir : \[rc://fr/ta/man/translate/figs-exclusive\])
TIT	3	3	rrx9	TIT_3_3_rrx9	ἦμεν…ἀνόητοι	Traductions alternatives : “nous étions… irréfléchis” ou “nous étions…inconsidérés” ou “nous étions… imprudents”
TIT	3	3	qt8f	TIT_3_3_qt8f	πλανώμενοι, δουλεύοντες ἐπιθυμίαις καὶ ἡδοναῖς ποικίλαις	La passion et le plaisir sont évoqués comme s’ils étaient les maîtres des hommes et avaient fait des esclaves ceux qui croyaient au mensonge. Traduction alternative : “Nous nous étions permis de croire au mensonge selon lequel diverses passions et plaisirs pouvaient nous rendre heureux, puis nous étions incapables de contrôler nos sentiments ou d’arrêter de faire des choses que nous pensions pouvoir nous donner du plaisir” (Voir : [[rc:/ /fr/ta/man/translate/figs-personnification]])
TIT	3	3	xy27	TIT_3_3_xy27	πλανώμενοι, δουλεύοντες ἐπιθυμίαις καὶ ἡδοναῖς ποικίλαις	Vous pouvez traduire cela à la voix active. Traduction alternative : “Diverses passions et plaisirs nous ont menti et nous ont fait perdre notre chemin”. (Voir : \[rc://en/ta/man/translate/figs-activepassive\])
TIT	3	3	tl5n	TIT_3_3_tl5n	ἐπιθυμίαις	Traduction alternative : “la convoitise” et ”les désirs”
TIT	3	3	dec4	TIT_3_3_dec4	ἐν κακίᾳ καὶ φθόνῳ διάγοντες	Ici, **le mal** et **l’envie** décrivent le péché. Le mot **mal** est général et **l’envie** est un type spécifique de péché. Traduction alternative : “Nous faisions toujours des choses mauvaises et voulions ce que les autres avaient”.
TIT	3	3	y5lp	TIT_3_3_y5lp	στυγητοί	Traduction alternative : “amenant les autres à nous haïr”
TIT	3	4	xy28	TIT_3_4_xy28	δὲ	Il est important de marquer par la conjonction “mais” le contraste entre la mauvaise voie des gens (versets 1-3) et la bonté de Dieu (versets 4-7) (Voir : [[rc://fr/ta/man/translate/grammar-connect- contraste logique]])
TIT	3	4	ba5a	TIT_3_4_ba5a	ὅτε…ἡ χρηστότης καὶ ἡ φιλανθρωπία ἐπεφάνη τοῦ Σωτῆρος ἡμῶν, Θεοῦ	Paul parle de la bonté et de l’amour de Dieu pour l’humanité comme s’ils étaient soudainement devenus visibles aux hommes. Traduction alternative : « quand Dieu notre Sauveur nous a montré sa bonté et son amour pour les êtres humains » (Voir : [[rc://fr/ta/man/translate/figs-personification]])
TIT	3	4	abcg	TIT_3_4_abcg	ὅτε…ἡ χρηστότης καὶ ἡ φιλανθρωπία ἐπεφάνη τοῦ Σωτῆρος ἡμῶν, Θεοῦ	Vous pouvez remplacer les noms abstraits **gentillesse** et **amour** par des adjectifs. Traduction alternative : “quand Dieu, qui nous sauve, a montré combien il est bon et aimant envers les êtres humains” (Voir : [[rc://fr/ta/man/translate/figs-abstractnouns]])
TIT	3	4	abch	TIT_3_4_abch	ἡμῶν	Dans cette phrase, le pronom, “nous”, inclut Paul, Tite, et tous les chrétiens. (See: [[rc://fr/ta/man/translate/figs-exclusive]])
TIT	3	5	n4ug	TIT_3_5_n4ug	κατὰ τὸ αὐτοῦ ἔλεος	La miséricorde est un nom abstrait qu’on peut exprimer de la façon suivante: Traduction alternative : “Par l’attribut divin par lequel Dieu montre combien il est compatissant, désireux de pardonner au coupable”
TIT	3	5	k1a6	TIT_3_5_k1a6	λουτροῦ παλινγενεσίας	Paul emploie deux métaphores. Premièrement, il parle du pardon de Dieu pour les pécheurs comme si Dieu les nettoyait physiquement de leur péché dans les eaux du baptême. Deuxièment, il parle des pécheurs qui ont reçu le pardon de Dieu comme s’ils étaient nés de nouveau et commençaient une nouvelle manière de vivre pour Dieu. (Voir : [[rc://fr/ta/man/translate/figs-metaphor]])
TIT	3	6	fby9	TIT_3_6_fby9	οὗ ἐξέχεεν ἐφ’ ἡμᾶς πλουσίως	Il est commun pour les écrivains du Nouveau Testament de parler du Saint-Esprit comme d’un liquide que Dieu peut verser en grandes quantités. Traduction alternative : « que Dieu nous a donné généreusement » (Voir : [rc://fr/ta/man/translate/figs-metaphor])
TIT	3	6	xy24	TIT_3_6_xy24	ἡμᾶς	Le pronom, “nous”, inclut Paul, Tite et tous les chrétiens. (Voir : [[rc://fr/ta/man/translate/figs-exclusive]])
TIT	3	6	q9ze	TIT_3_6_q9ze	διὰ Ἰησοῦ Χριστοῦ, τοῦ Σωτῆρος ἡμῶν	« quand Jésus-Christ nous a sauvés »
TIT	3	6	xy23	TIT_3_6_xy23	ἡμῶν	Le pronom possessif “notre” dit que Jésus Christ est le sauveur de Paul, Tite, et de tous les chrétiens. (See: [[rc://fr/ta/man/translate/figs-exclusive]])
TIT	3	7	di3g	TIT_3_7_di3g	δικαιωθέντες	Vous pouvez utiliser la voix active. Traduction alternative : “puisque Dieu nous a déclarés sans péché” (Voir : [[rc://fr/taman/translation/figs-active passive]])
TIT	3	7	q1cm	TIT_3_7_q1cm	κληρονόμοι γενηθῶμεν, κατ’ ἐλπίδα ζωῆς αἰωνίου	On parle du peuple à qui Dieu a fait des promesses comme s’il devait hériter des choses promises, tout comme une personne hérite des biens ou des possessions d’un membre de sa famille. Traduction alternative : “nous pouvons nous attendre à recevoir la vie éternelle que Dieu nous a promise” (Voir : [[rc://fr/ta/man/translate/figs-metaphor]])
TIT	3	8	j8md	TIT_3_8_j8md	ὁ λόγος	Le message est celui qui vient d’être exprimé dans les versets 4-7, que Dieu donne librement le Saint-Esprit et la vie éternelle aux croyants par Jésus.
TIT	3	8	xy29	TIT_3_8_xy29	τούτων	**ces choses** font référence aux enseignements de Paul dans les versets 1-7. Traduction alternative : “ces enseignements dont je viens de parler”
TIT	3	8	kqm6	TIT_3_8_kqm6	φροντίζωσιν καλῶν ἔργων, προΐστασθαι	Paul dit à Tite qu’il doit insister que les croyants prennent soin de s’engager dans les bonnes oeuvres. Traduction alternative : “prennent soin de s’engager dans de bonnes œuvres”
TIT	3	9	tzh9	TIT_3_9_tzh9		Paul explique ce que Tite devrait éviter et comment il devrait traiter ceux qui provoquent des querelles parmi les croyants.
TIT	3	9	j1hf	TIT_3_9_j1hf	δὲ…περιΐστασο	Ayant présenté à Tite ce qu’íl doit faire, Paul met en opposition les choses dont il doit se protéger. Traductions alternatives : “Alors évitez” ou “Par conséquent, évitez”
TIT	3	9	xnf9	TIT_3_9_xnf9	μωρὰς…ζητήσεις	Traductions alternatives : “les arguments concernant des questions sans importance” ou “les discussions qui n’ont aucune valeur, qui sont absurdes” 
TIT	3	9	qk66	TIT_3_9_qk66	γενεαλογίας	Il s’agit de la science ou l’étude qui a pour objet la recherche des filiations, des relations familiales. Voir l’Introduction à Titus.
TIT	3	9	xu7f	TIT_3_9_xu7f	ἔρεις	Paul parle des disputes, des controverses, des arguments que les dirigeants juifs avaient au sujet des lois religieuses d’Israel. Traductions alternatives : “arguments” ou “disputes”
TIT	3	9	ky3n	TIT_3_9_ky3n	νομικὰς	Traduction alternative : “à propos de la loi de Moïse”
TIT	3	10	x3fh	TIT_3_10_x3fh	αἱρετικὸν ἄνθρωπον…παραιτοῦ	Traductions alternatives : “Écarte-toi de la personne qui cause la division” ou “Maintient de la distance entre toi et la personne qui sème la discorde”
TIT	3	10	xzx1	TIT_3_10_xzx1	μετὰ μίαν καὶ δευτέραν νουθεσίαν	Paul désire que Tite avertisse une personne divisive une ou deux fois avant de les rejeter. Traduction alternative : ”après avoir averti cette personne une ou deux fois”
TIT	3	11	r7pc	TIT_3_11_r7pc	ὁ τοιοῦτος	Il s’agit d’une personne divisive comme celle que Paul va décrire. Traduction alternative : “Une personne mauvaise comme celle dont je parle”
